{
  "bundle_version": "1",
  "canonicalization": "proofdrift-json-v1",
  "created_at": "2026-09-10T00:00:00Z",
  "entries": [
    {
      "path": "events.jsonl",
      "sha256": "aaaaaaaaaaaaaaaaaaaaaaaaaaaaaaaaaaaaaaaaaaaaaaaaaaaaaaaaaaaaaaaa",
      "size_bytes": 42
    }
  ],
  "schema_version": "1.0.0",
  "session_id": "sess-1"
}
